{
  "source_id": "official_warning_capture_2026_09_24",
  "source_url": "https://moneysmart.gov.au/check-and-report-scams/investor-alert-list#!ai-pro-app--aussiebrief-com--4778",
  "downloaded_at": "2026-09-24T00:00:00+07:00",
  "source_version": "EXTCAP_CONF_007 official warning capture",
  "license_or_terms": "Public regulator page captured for internal evidence review. This manifest grants no redistribution right; source terms continue to apply.",
  "raw_label_semantics": "Official warning evidence only. It is not observed solicitation text, is not model input, and does not automatically create a ground-truth label.",
  "raw_file_sha256": "9f3efcdd5ece1aaab45b147e4d1024313a4f379b0edf7a1268f464e04cae7f5a",
  "storage_path": "D:/nckh 2026-2027/ISI_Data/raw/external_warning_evidence/2026-09-24/official_notices/EXTCAP_CONF_007__moneysmart.gov.au.html"
}
