{
  "source_id": "wayback_confirmed_capture_2026_09_24",
  "source_url": "https://web.archive.org/web/20260606142353id_/https://veld-luxaris.com/",
  "downloaded_at": "2026-09-24T00:00:00+07:00",
  "source_version": "EXTCAP_RESERVE_CONF_008 snapshot 20260606142353",
  "license_or_terms": "Internet Archive replay captured for internal research validation. This manifest grants no redistribution right; source and archive terms continue to apply.",
  "raw_label_semantics": "Unlabeled archived HTML associated with an IOSCO warning candidate. The archive capture and warning reference require human reconciliation and are not an automatic scam label.",
  "raw_file_sha256": "e592b1fe9ea62a4828d7da392efea558e30d130de7b049a01452397a2db796f5",
  "storage_path": "D:/nckh 2026-2027/ISI_Data/raw/external_text_captures/2026-09-24/confirmed_wayback/EXTCAP_RESERVE_CONF_008__veld-luxaris.com.html"
}
