{
  "source_id": "official_warning_capture_2026_09_24",
  "source_url": "https://www.finma.ch/en/finma-public/warnungen/warning-list/corpholding-corpholding-com/",
  "downloaded_at": "2026-09-24T00:00:00+07:00",
  "source_version": "EXTCAP_CONF_009 official warning capture",
  "license_or_terms": "Public regulator page captured for internal evidence review. This manifest grants no redistribution right; source terms continue to apply.",
  "raw_label_semantics": "Official warning evidence only. It is not observed solicitation text, is not model input, and does not automatically create a ground-truth label.",
  "raw_file_sha256": "20982d7cb29f369a28309f9c1752dd52b4fb01b2c875af2bb40a2c78ed0aeaa6",
  "storage_path": "D:/nckh 2026-2027/ISI_Data/raw/external_warning_evidence/2026-09-24/official_notices/EXTCAP_CONF_009__finma.ch.html"
}
