{
  "source_id": "sec_iapd_homepage_capture_2026_09_24",
  "source_url": "https://bristolgroupinc.com/",
  "downloaded_at": "2026-09-23T23:38:05.3476822Z",
  "source_version": "EXTCAP_RESERVE_LEGIT_002 homepage capture; SEC/IAPD CRD 105087",
  "license_or_terms": "Public website captured only for internal research validation. This manifest grants no redistribution right; source terms and copyright continue to apply.",
  "raw_label_semantics": "Unlabeled HTML captured from a host listed in an SEC/IAPD filing. The capture and registration reference do not by themselves prove content legitimacy, current control, or safety.",
  "raw_file_sha256": "c34d730370a2d329a2ac4e9a50d68e9aeabb36503ff91d8b45ac552a86990789",
  "storage_path": "D:/nckh 2026-2027/ISI_Data/raw/external_text_captures/2026-09-24/legitimate/EXTCAP_RESERVE_LEGIT_002__bristolgroupinc.com.html"
}
