{
  "source_id": "wayback_confirmed_capture_2026_09_24",
  "source_url": "https://web.archive.org/web/20260712180003id_/https://kuberamarkets.com/",
  "downloaded_at": "2026-09-24T00:00:00+07:00",
  "source_version": "EXTCAP_CONF_008 snapshot 20260712180003",
  "license_or_terms": "Internet Archive replay captured for internal research validation. This manifest grants no redistribution right; source and archive terms continue to apply.",
  "raw_label_semantics": "Unlabeled archived HTML associated with an IOSCO warning candidate. The archive capture and warning reference require human reconciliation and are not an automatic scam label.",
  "raw_file_sha256": "a078b90304668c008b0c304ef2cb3ccd582bd6542659c3f1ce7ab02c49fc5831",
  "storage_path": "D:/nckh 2026-2027/ISI_Data/raw/external_text_captures/2026-09-24/confirmed_wayback/EXTCAP_CONF_008__kuberamarkets.com.html"
}
