{
  "source_id": "crimson_www_2025",
  "source_url": "https://github.com/pragseclab/Crimson",
  "downloaded_at": "2026-09-08T14:09:34.505422+00:00",
  "source_version": "b040e2def08ea26058ef9da752b72fa4a5238987",
  "license_or_terms": "GPL-3.0",
  "raw_label_semantics": "Research-detected cryptocurrency investment-scam websites; not a legal finding and not eligible for real-world Gold evaluation.",
  "raw_file_sha256": "5b6f5d8cbcf780fd63437d8ef3abdc7a261deac5d1845a8ffb4201fbf9e313c0",
  "storage_path": "D:/nckh 2026-2027/ISI_Data/raw/crimson_www_2025/b040e2def08ea26058ef9da752b72fa4a5238987/data.json"
}
